футбол смотреть онлайн;просмотр online
маргоша сезон смотреть онлайн;просмотр online
фильмы смотреть онлайн;просмотр online
хочу тв смотреть онлайн;просмотр online
худею фильм смотреть онлайн;просмотр online
шестой пост смотреть онлайн;просмотр online
излом времени смотреть онлайн;просмотр online
фильме андрея кондрашова путин смотреть онлайн;просмотр online
тестовые задания класса егэ смотреть онлайн;просмотр online
лед смотреть онлайн hd;просмотр online
делает твоя жена смотреть онлайн;просмотр online
перевод гоблина смотреть онлайн;просмотр online
номер смотреть онлайн ютуб;просмотр online
художественный фильм путин смотреть онлайн;просмотр online
фильмы жизнь иисуса христа смотреть онлайн бесплатно хорошем качестве;просмотр online
навсегда девушка фильм смотреть онлайн;просмотр online
холостяк егор крид серия смотреть онлайн;просмотр online
люцифер смотреть онлайн сезоны хорошем качестве hd;просмотр online
тв - смотреть онлайн прямой эфир;просмотр online
пусть говорят выпуск г смотреть онлайн;просмотр online
сибирские снайперы белые медведи смотреть онлайн;просмотр online
мульт танки смотреть онлайн бесплатно;просмотр online
царство сериал сезон смотреть онлайн;просмотр online
фильм золотая орда сериал смотреть онлайн россия бесплатно;просмотр online
золотая орда сериал смотреть онлайн;просмотр online
крым смотреть онлайн;просмотр online
кости смотреть онлайн сезон список серий;просмотр online
последний миг смотреть онлайн;просмотр online
смотреть онлайн гигпорно мастурбация;просмотр online
жажда смерти смотреть онлайн;просмотр online
матч тв смотреть онлайн;просмотр online
худею фильм смотреть онлайн;просмотр online
золотая орда смотреть онлайн фильм хорошем качестве;просмотр online
укрощение любовью уитни фильм смотреть онлайн;просмотр online
смешная реклама безалкогольного пива баклер смотреть онлайн;просмотр online
кино красавица чудовище смотреть онлайн бесплатно хорошем;просмотр online
фиксипелки смотреть онлайн серии подряд;просмотр online
детройт смотреть онлайн;просмотр online
родословная фильм смотреть онлайн;просмотр online
след смотреть онлайн;просмотр online
мультик распрекрасный смотреть онлайн;просмотр online
турецкие сериалы русском языке смотреть онлайн;просмотр online
ольга смотреть онлайн;просмотр online
ютуб сериал обратная сторона луны сезон смотреть онлайн бесплатно;просмотр online
имя короля смотреть онлайн hd;просмотр online
фильмы смотреть онлайн;просмотр online
форма воды смотреть онлайн бесплатно;просмотр online
короче фильм смотреть онлайн hd;просмотр online
смотреть онлайн бесплатно шоу холостяк егором кридом выпуск;просмотр online
ходячие мертвецы смотреть онлайн;просмотр online
ероманга сенсей смотреть онлайн;просмотр online
тяжкие смотреть онлайн;просмотр online
сумерки смотреть онлайн хорошем качестве;просмотр online
золотая орда сериал смотреть онлайн;просмотр online
фильмы похищение девушек продажу рабство смотреть онлайн;просмотр online
неловкий момент смотреть онлайн hd хорошем качестве;просмотр online
билборда границе эббинга миссури смотреть онлайн;просмотр online
дивергент смотреть онлайн;просмотр online
смотреть онлайн сериал улица;просмотр online
твоё имя смотреть онлайн хорошей озвучкой онлайн бесплатно;просмотр online
порно смотреть онлайн дойки;просмотр online
человек закон смотреть онлайн;просмотр online
фильм золотая орда сериал смотреть онлайн россия бесплатно;просмотр online
пепа свинка смотреть онлайн серии подряд новые серии;просмотр online
буба мультик смотреть онлайн;просмотр online
недфорспид фильм смотреть онлайн хорошем качестве;просмотр online
оружие сериал смотреть онлайн бесплатно хорошем качестве;просмотр online
тайный дневник девушки вызову смотреть онлайн;просмотр online
джуманджи смотреть онлайн;просмотр online
igra prestolov sezon фильм смотреть онлайн;просмотр online
команда б смотреть онлайн;просмотр online
леди против рикки бахла смотреть онлайн;просмотр online
мультики князь владимир смотреть онлайн бесплатно хорошем качестве;просмотр online
бизнес казахский фильм смотреть онлайн бесплатно;просмотр online
фильм скиф смотреть онлайн хорошем качестве бесплатно;просмотр online
смотреть онлайн бесплатно россия сериал орда;просмотр online
дня любви сериал смотреть онлайн;просмотр online
акула юрского периода фильм смотреть онлайн;просмотр online
самые страшные видео игры это последние годы смотреть онлайн;просмотр online
смотреть убить выпускной смотреть онлайн hd;просмотр online
вуличне правосуддя смотреть онлайн;просмотр online
холостяк смотреть онлайн;просмотр online
фильм невидимый гость смотреть онлайн;просмотр online
новинки кино смотреть онлайн;просмотр online
мультфильм взрослқх смотреть онлайн;просмотр online
коробка смотреть онлайн фильм хорошем качестве;просмотр online
люцифер сезон серия смотреть онлайн лостфильм;просмотр online
полнолуние турецкий сериал смотреть онлайн русском языке;просмотр online
алиби двоих сезон смотреть онлайн хорошем качестве;просмотр online
цвет черёмухи смотреть онлайн серии хорошем качестве;просмотр online
автобусом лосанжелеса смотреть онлайн;просмотр online
холостяк смотреть онлайн сезоны подряд хорошем качестве hd;просмотр online
фильм чёрная пантера hd качестве смотреть онлайн;просмотр online
мумия смотреть онлайн хорошим переводом хорошем качестве;просмотр online
деффчонки смотреть онлайн;просмотр online
смотреть онлайн фильмы хорошем качестве;просмотр online
топ гир смотреть онлайн;просмотр online
откажусь смотреть онлайн;просмотр online
слепая смотреть онлайн;просмотр online
чёрная молния фильм смотреть онлайн;просмотр online
кинопоиск гладиатор смотреть онлайн;просмотр online
русские военные фильмы смотреть онлайн бесплатно хорошем качестве;просмотр online
худею смотреть онлайн;просмотр online
мойдодыр мультфильм смотреть онлайн;просмотр online
лед смотреть онлайн фильм хорошем качестве;просмотр online
черная пантера смотреть онлайн;просмотр online
порно смотреть онлайн;просмотр online
елизавета золотой век смотреть онлайн;просмотр online
марал турецкий сериал смотреть онлайн русском языке;просмотр online
возраст любви смотреть онлайн;просмотр online
люцифер сезоны смотреть онлайн;просмотр online
американский сериал родина сезон смотреть онлайн хорошем качестве;просмотр online
дом кино смотреть онлайн прямой эфир бесплатно хорошем качестве;просмотр online
юмор - х смотреть онлайн;просмотр online
золотая орда кино смотреть онлайн;просмотр online
ранние годы жизни билли грэма смотреть онлайн хорошем качестве;просмотр online
программа минут последний выпуск смотреть онлайн;просмотр online
золотая орда сериал смотреть онлайн;просмотр online
аквариум фильм смотреть онлайн;просмотр online
спартак сезон смотреть онлайн серии хорошем качестве;просмотр online
домашний смотреть онлайн прямой эфир;просмотр online
готэм сезон смотреть онлайн;просмотр online
тетя пришла турецкий фильм смотреть онлайн русском;просмотр online
худею смотреть онлайн;просмотр online
вавилонская башня серия смотреть онлайн;просмотр online
скуби ду сезон смотреть онлайн;просмотр online
теодори з васюківки смотреть онлайн;просмотр online
ночные игры смотреть онлайн;просмотр online
тяжкие смотреть онлайн;просмотр online
ривердейл сезон серия смотреть онлайн;просмотр online
бык фердинанд смотреть онлайн мультфильм хорошем качестве бесплатно;просмотр online
казахстанте каникулы тайланде смотреть онлайн;просмотр online
властелин колец режиссерская версия смотреть онлайн hd;просмотр online
смотреть онлайн саша таня;просмотр online
хорошая борьба смотреть онлайн hd;просмотр online
чёрная эммануэль смотреть онлайн;просмотр online
золотая орда сериал смотреть онлайн;просмотр online
боевики зарубежные которые смотреть онлайн;просмотр online
лара крофт смотреть онлайн фильм;просмотр online
кинконг остров черепа смотреть онлайн;просмотр online
золотая орда смотреть онлайн;просмотр online
самий лучший день фільм смотреть онлайн;просмотр online
опасные связи фильм россия смотреть онлайн;просмотр online
невский смотреть онлайн серии подряд хорошем качестве;просмотр online
госпожа умница смотреть онлайн;просмотр online
лёд фильм смотреть онлайн;просмотр online
господин никто смотреть онлайн hd бесплатно хорошим переводом;просмотр online
социальная сеть смотреть онлайн;просмотр online
реальные пацаны сезон смотреть онлайн серии подряд;просмотр online
извести любовницу дней фильм смотреть онлайн;просмотр online
золотая орда сериал смотреть онлайн;просмотр online
мерлин сериал смотреть онлайн;просмотр online
билборда границе эббинга миссури смотреть онлайн;просмотр online
avon каталог года смотреть онлайн россия бесплатно листать;просмотр online
золотая орда сериал смотреть онлайн;просмотр online
детективные сериалы россия смотреть онлайн;просмотр online
твоя пакхи индийский сериал смотреть онлайн русская озвучка серии;просмотр online
русский детектив ютубе смотреть онлайн;просмотр online
посвященный смотреть онлайн;просмотр online
фильм собибор смотреть онлайн;просмотр online
сфера смотреть онлайн фильм хорошем качестве;просмотр online
золотая орда сериал смотреть онлайн бесплатно серии подряд;просмотр online
джамайка смотреть онлайн серии бесплатно хорошем качестве;просмотр online
барбоскины серии подряд смотреть онлайн бесплатно;просмотр online
канал смотреть онлайн;просмотр online
sex doll смотреть онлайн;просмотр online
матч тв смотреть онлайн прямой эфир бесплатно хорошем качестве;просмотр online
тв звезда смотреть онлайн прямой эфир;просмотр online
легион смотреть онлайн;просмотр online
смотреть онлайн фильмы бесплатно русские детективы;просмотр online
сериал меч сезон смотреть онлайн серии хорошем качестве hd;просмотр online
фильм посейдон смотреть онлайн;просмотр online
добрые сказки смотреть онлайн бесплатно хорошем качестве;просмотр online
смотреть онлайн ретро порно;просмотр online
канал евроспорт смотреть онлайн прямой эфир бесплатно;просмотр online
золотая орда сериал смотреть онлайн;просмотр online
аннигиляция смотреть онлайн;просмотр online
фантастика звёздные врата серии смотреть онлайн бесплатно;просмотр online
золотая орда сериал смотреть онлайн;просмотр online
провал времени фильм смотреть онлайн;просмотр online
пятьдесятков оттенков свободы смотреть онлайн;просмотр online
команда б смотреть онлайн;просмотр online
оттенков свободы смотреть онлайн;просмотр online
легенды завтрашнего дня сезон серия смотреть онлайн;просмотр online
сверхестественое13 - й сезон смотреть онлайн;просмотр online
короче фильм смотреть онлайн hd;просмотр online
тв3 смотреть онлайн прямой эфир бесплатно хорошем качестве;просмотр online
смотреть онлайн земля людей;просмотр online
теория заговора гибсон смотреть онлайн;просмотр online
кхл тв смотреть онлайн;просмотр online
лёд фильм смотреть онлайн;просмотр online
разум машина смотреть онлайн хорошем качестве;просмотр online
май литл пони кино смотреть онлайн бесплатно хорошем качестве;просмотр online
жизнь розовом цвете смотреть онлайн;просмотр online
золотая орда сериал смотреть онлайн серии;просмотр online
менталист смотреть онлайн;просмотр online
одноклассники смотреть онлайн;просмотр online
игра понижение смотреть онлайн;просмотр online
смотреть онлайн бесплатно странный отец серия;просмотр online
смотреть лед смотреть онлайн;просмотр online
пусть говорят шурыгина часть смотреть онлайн;просмотр online
бесславные ублюдки смотреть онлайн hd русском языке полностью;просмотр online
кино коробка смотреть онлайн;просмотр online
воскресший эртугрул сезон серия смотреть онлайн русском языке;просмотр online
механик расти мультфильм смотреть онлайн;просмотр online
смотреть онлайн звездные войны последние джедаи hd;просмотр online
вселенная стивена хокинга фильм смотреть онлайн hd;просмотр online
золотая орда смотреть онлайн фильм хорошем качестве;просмотр online
смотреть онлайн сериал случайная любовь;просмотр online
жизнь впереди смотреть онлайн;просмотр online
фильм осколки смотреть онлайн бесплатно серии подряд;просмотр online
кино лёд смотреть онлайн;просмотр online
мир смотреть онлайн бесплатно;просмотр online
незнакомцы смотреть онлайн;просмотр online
украина смотреть онлайн прямой эфир;просмотр online
смотреть онлайн фильмы года российские которые вышли;просмотр online
зверополис мультфильм года смотреть онлайн бесплатно;просмотр online
смотреть онлайн порно фильмы;просмотр online
интерстеллар смотреть онлайн;просмотр online
королевы крика сезон смотреть онлайн;просмотр online
фильм золотая орда смотреть онлайн серия;просмотр online
золотая орда6 смотреть онлайн фильм хорошем качестве серия;просмотр online
таймлесс смотреть онлайн hd;просмотр online
богатыря принцесса египта смотреть онлайн;просмотр online
фильм кука смотреть онлайн бесплатно;просмотр online
маша медведь серии подряд перерыва смотреть онлайн;просмотр online
золотая орда смотреть онлайн фильм хорошем качестве;просмотр online
фильм золотая орда сериал смотреть онлайн;просмотр online
остров смотреть онлайн;просмотр online
фильмы смотреть онлайн;просмотр online
доктор хаус смотреть онлайн;просмотр online
интерны смотреть онлайн;просмотр online
кино смотреть онлайн;просмотр online
сталкер русский сериал смотреть онлайн;просмотр online
матч арена смотреть онлайн;просмотр online
биг синема смотреть онлайн;просмотр online
турецкие сериалы русском языке смотреть онлайн;просмотр online
воспоминания будущем смотреть онлайн;просмотр online
бандитский петербург смотреть онлайн бесплатно;просмотр online
сериал высокие ставки смотреть онлайн бесплатно;просмотр online
сериал друзья смотреть онлайн;просмотр online
блудливая калифорния сериал смотреть онлайн;просмотр online
саботаж смотреть онлайн бесплатно хорошем качестве;просмотр online
бесстыдники смотреть онлайн;просмотр online
мужское женское первый канал смотреть онлайн бесплатно хорошем качестве;просмотр online
рюриковичи история династии смотреть онлайн серии;просмотр online
фильм личный интерес смотреть онлайн;просмотр online
последняя застава смотреть онлайн;просмотр online
величайший шоумен смотреть онлайн фильм хорошем качестве;просмотр online
улетные девченки смотреть онлайн;просмотр online
люди икс последняя битва фильм смотреть онлайн бесплатно хорошем качестве;просмотр online
оттенков свободы смотреть онлайн фильм полностью;просмотр online
сериал тьма смотреть онлайн хорошем hd качестве;просмотр online
золотая орда смотреть онлайн фильм хорошем качестве;просмотр online
вечер владимиром соловьевым года смотреть онлайн бесплатно;просмотр online
фильм смотреть онлайн;просмотр online
любовь наказание смотреть онлайн турецкий сериал русском языке;просмотр online
алиенист смотреть онлайн;просмотр online
золотая орда смотреть онлайн фильм хорошем качестве;просмотр online
фильм золотая орда сериал смотреть онлайн россия бесплатно;просмотр online
мальчишник вегасе смотреть онлайн;просмотр online
встречи тобой смотреть онлайн;просмотр online
бригада смотреть онлайн;просмотр online
