футбол смотреть онлайн;просмотр online
шоу американский жених сезон смотреть онлайн бесплатно серии;просмотр online
первый канал смотреть онлайн;просмотр online
неловкий момент смотреть онлайн;просмотр online
смотреть онлайн фильмы года бесплатно хорошем качестве новинки;просмотр online
осколки смотреть онлайн;просмотр online
пуаро смотреть онлайн;просмотр online
екатерина сезон смотреть онлайн серия;просмотр online
каменская французском языке сериал смотреть онлайн;просмотр online
малыш драйве смотреть онлайн;просмотр online
элементарно смотреть онлайн;просмотр online
форс мажоры смотреть онлайн бесплатно хорошем качестве;просмотр online
тофик шахвердиев умереть любви смотреть онлайн;просмотр online
шоу кливленда смотреть онлайн;просмотр online
исчезновение смотреть онлайн;просмотр online
смотреть онлайн;просмотр online
ученик чародея смотреть онлайн фильм хорошем качестве;просмотр online
смотреть онлайн маша медведь серии подряд;просмотр online
против правил смотреть онлайн;просмотр online
смотреть онлайн королевство ветров;просмотр online
проспект бразилии смотреть онлайн канал серии;просмотр online
обратный отсчёт сериал россия смотреть онлайн;просмотр online
сериал осколки россия смотреть онлайн;просмотр online
великолепный век смотреть онлайн;просмотр online
первый канал россия смотреть онлайн прямой эфир;просмотр online
золотая орда сериал смотреть онлайн;просмотр online
ту сторону смерти смотреть онлайн;просмотр online
отчаянные домохозяйки смотреть онлайн;просмотр online
ментовские войны сезон смотреть онлайн hd качестве бесплатно;просмотр online
люцифер сезон смотреть онлайн hd качестве lostfilm;просмотр online
свинка пеппа смотреть онлайн серии подряд;просмотр online
тв3 смотреть онлайн прямой эфир;просмотр online
твой выход детка смотреть онлайн;просмотр online
пандора сериал смотреть онлайн серии хорошем качестве;просмотр online
смотреть онлайн свинка пеппа куклы;просмотр online
фильмы произведениям людмилы улицкой смотреть онлайн;просмотр online
стыд фильм смотреть онлайн;просмотр online
погоня прошлым смотреть онлайн бесплатно хорошем качестве;просмотр online
изгой - звёздные смотреть онлайн;просмотр online
зона12 стронг смотреть онлайн;просмотр online
сериал ответный удар сезон смотреть онлайн;просмотр online
посмотреть онлайн фильм отец браун смертельный таней;просмотр online
смотреть онлайн французский скам;просмотр online
filmi смотреть онлайн;просмотр online
смотреть онлайн бе;просмотр online
постеры / ф рябиновый вальс смотреть онлайн;просмотр online
золотая орда сериал смотреть онлайн;просмотр online
шанхайские рыцари смотреть онлайн бесплатно хорошем качестве;просмотр online
маша медведь смотреть онлайн бесплатно серии;просмотр online
пенза тв канал смотреть онлайн;просмотр online
фильм отряд особого назначения смотреть онлайн;просмотр online
круговорот сериал смотреть онлайн бесплатно;просмотр online
худею смотреть онлайн;просмотр online
нами космос смотреть онлайн;просмотр online
друзья смотреть онлайн;просмотр online
развивающие мультики детей лет смотреть онлайн;просмотр online
тарзан смотреть онлайн;просмотр online
золотая орда сериал смотреть онлайн;просмотр online
список документальный фильм диких хищных животных смотреть онлайн;просмотр online
смотреть онлайн мультики года новинки;просмотр online
сериал осколки россия смотреть онлайн;просмотр online
склифосовский сезон смотреть онлайн;просмотр online
сериал кровавая барыня смотреть онлайн бесплатно;просмотр online
ненависти любви смотреть онлайн;просмотр online
мост смотреть онлайн;просмотр online
смотреть онлайн сериал след год серии подряд;просмотр online
сериал анатомия страсти сезон смотреть онлайн бесплатно;просмотр online
сериал восток запад смотреть онлайн бесплатно серии;просмотр online
реальные пацаны сезон смотреть онлайн;просмотр online
лёд фильм смотреть онлайн;просмотр online
фильмы детективы триллеры драмы зарубежные смотреть онлайн;просмотр online
атлантический рубеж смотреть онлайн бесплатно хорошем качестве;просмотр online
женские забавы смотреть онлайн бесплатно;просмотр online
друзья смотреть онлайн;просмотр online
тв детский смотреть онлайн бесплатно;просмотр online
подруг оушена смотреть онлайн;просмотр online
петр завещание серия смотреть онлайн;просмотр online
фильмы романам михалковой илюшина бабкина смотреть онлайн;просмотр online
евроспорт плей смотреть онлайн прямой эфир;просмотр online
ковбой бибоп смотреть онлайн озвучка 2х2;просмотр online
конверт смотреть онлайн;просмотр online
ньюзван канал украина смотреть онлайн прямой эфир украина;просмотр online
железное небо2 смотреть онлайн;просмотр online
отряд самоубийц смотреть онлайн;просмотр online
мультфильм барбарики смотреть онлайн бесплатно серии подряд;просмотр online
коловрат смотреть онлайн фильм хорошем качестве русском;просмотр online
сваты сезон смотреть онлайн бесплатно хорошем качестве серии;просмотр online
золото дураков фильм смотреть онлайн hd;просмотр online
золотая орда сериал смотреть онлайн;просмотр online
фильмы смотреть онлайн;просмотр online
канал рада украина смотреть онлайн прямой эфир;просмотр online
смотреть онлайн барбоскины;просмотр online
недруги смотреть онлайн фильм хорошем качестве;просмотр online
смотреть онлайн фильм;просмотр online
холостяк сезон смотреть онлайн серии украина;просмотр online
кино спас березами смотреть онлайн первой серии;просмотр online
адъютант превосходительства смотреть онлайн;просмотр online
холостяк егор крид серия смотреть онлайн;просмотр online
икса мировое господство смотреть онлайн;просмотр online
гарри поттер орден феникса смотреть онлайн;просмотр online
агенты анкл смотреть онлайн;просмотр online
реальные пацаны очень важные пермяки смотреть онлайн;просмотр online
сериал спящие сезон смотреть онлайн hd качестве;просмотр online
викинг смотреть онлайн фильм хорошем качестве;просмотр online
порно кучерявыми девушками смотреть онлайн;просмотр online
ч м студенты россии кбгу - кгту смотреть онлайн;просмотр online
мультфильмы английском языке русскими субтитрами смотреть онлайн;просмотр online
сериал кости смотреть онлайн;просмотр online
комедии смотреть онлайн;просмотр online
одержимость индия смотреть онлайн русском языке;просмотр online
елена сафонова поисках любви смотреть онлайн;просмотр online
ешь молись люби русском смотреть онлайн;просмотр online
золотая орда сериал смотреть онлайн серии;просмотр online
канал модный приговор сегодняшний выпуск смотреть онлайн;просмотр online
золотая орда смотреть онлайн фильм хорошем качестве;просмотр online
ловушка ангела сериал смотреть онлайн бесплатно;просмотр online
ледяная стерва смотреть онлайн;просмотр online
простые истины смотреть онлайн серии подряд;просмотр online
сериал джеймстаун смотреть онлайн;просмотр online
новая последняя серия сезона экстрасенсы битва сильнейших расследования смотреть онлайн;просмотр online
ральф смотреть онлайн;просмотр online
говорят мужчины продолжение смотреть онлайн;просмотр online
нападение южных жареных зомби смотреть онлайн;просмотр online
сериал осколки серия смотреть онлайн бесплатно;просмотр online
любовь грех турецкий сериал смотреть онлайн русском языке;просмотр online
рой цю смотреть онлайн фильм;просмотр online
мелодрами які вже вийшли смотреть онлайн;просмотр online
жемчужина нила смотреть онлайн хорошим переводом хорошем качестве;просмотр online
тульский токарев сериал смотреть онлайн;просмотр online
андрей кондрашов путин часть смотреть онлайн;просмотр online
чужестранка сезон смотреть онлайн;просмотр online
обратный отсчёт сериал россия смотреть онлайн;просмотр online
лед смотреть онлайн фильм хорошем качестве;просмотр online
титаник смотреть онлайн;просмотр online
фильм золотая орда сериал смотреть онлайн россия бесплатно;просмотр online
страна призраков смотреть онлайн;просмотр online
зомбоящик смотреть онлайн бесплатно полный фильм хорошем качестве;просмотр online
запутанные отношения индийский сериал смотреть онлайн русском языке;просмотр online
останусь смотреть онлайн;просмотр online
ту сторону смерти сериал россия смотреть онлайн;просмотр online
черная кровь смотреть онлайн;просмотр online
смотреть онлайн фильмы бесплатно бегущий лабиринте;просмотр online
смотреть онлайн дома;просмотр online
величайший шоумен фильм смотреть онлайн;просмотр online
супер секс смотреть онлайн;просмотр online
золотая орда сериал смотреть онлайн;просмотр online
холостяк сезон егор крид смотреть онлайн выпуски хорошем качестве;просмотр online
фильм ту сторону смерти смотреть онлайн;просмотр online
рождённая революцией смотреть онлайн бесплатно серии подряд;просмотр online
последняя любовь земле смотреть онлайн;просмотр online
брачный договор смотреть онлайн бесплатно хорошем качестве;просмотр online
секретное досье смотреть онлайн фильм хорошем качестве;просмотр online
гризли лемминги смотреть онлайн;просмотр online
уральские пельмени загсе смотреть онлайн;просмотр online
индийский фильм бахубали смотреть онлайн;просмотр online
сериал профиль убийцы сезон россия смотреть онлайн;просмотр online
холостяк смотреть онлайн серия;просмотр online
ножах константином ивлевым смотреть онлайн;просмотр online
мужское женское вчерашний выпуск смотреть онлайн бесплатно;просмотр online
дневники вампира смотреть онлайн;просмотр online
золотая орда смотреть онлайн фильм хорошем качестве;просмотр online
оттенков свободы смотреть онлайн бесплатно hd;просмотр online
твц смотреть онлайн;просмотр online
дом смотреть онлайн;просмотр online
перелетные птицы документальный фильм смотреть онлайн;просмотр online
последняя статья журналиста смотреть онлайн;просмотр online
восхождение юпитер смотреть онлайн;просмотр online
тв смотреть онлайн прямой эфир бесплатно хорошем качестве;просмотр online
черная пантера смотреть онлайн;просмотр online
сериал меч смотреть онлайн серии хорошем качестве hd;просмотр online
великолепный век сезон серия смотреть онлайн русском языке;просмотр online
рубиновая книга смотреть онлайн часть;просмотр online
смотреть онлайн сверхъестественное сезон рен тв;просмотр online
гигпорно смотреть онлайн;просмотр online
неугомонные друзья мультсериал смотреть онлайн;просмотр online
снеговик смотреть онлайн бесплатно хорошем качестве;просмотр online
улица смотреть онлайн;просмотр online
воронины сезон серия смотреть онлайн;просмотр online
осколки смотреть онлайн;просмотр online
кино смотреть онлайн;просмотр online
холостяк смотреть онлайн серия;просмотр online
марал турецкий сериал смотреть онлайн русском языке;просмотр online
канал русский роман смотреть онлайн прямой эфир;просмотр online
люцифер сезон серия смотреть онлайн;просмотр online
экранизация романов смотреть онлайн;просмотр online
мужское женское выпуск г смотреть онлайн;просмотр online
великолепный век смотреть онлайн бесплатно серии хорошем качестве;просмотр online
тв россия смотреть онлайн прямой эфир бесплатно хорошем качестве;просмотр online
квартирантка русская мелодрама смотреть онлайн;просмотр online
золотая орда сериал смотреть онлайн ютуб 2серия;просмотр online
марсианин смотреть онлайн;просмотр online
нст смотреть онлайн прямой эфир;просмотр online
осколки смотреть онлайн серия;просмотр online
смотреть онлайн хентай;просмотр online
фантастика ужасы смотреть онлайн;просмотр online
оттенков свободы смотреть онлайн;просмотр online
форма воды смотреть онлайн фильм хорошем качестве;просмотр online
холостяк егор крид серия смотреть онлайн;просмотр online
разведчицы смотреть онлайн серии подряд хорошем качестве;просмотр online
смотреть фильм спартак кровь песок сезон смотреть онлайн;просмотр online
золотая орда сериал смотреть онлайн;просмотр online
золотая орда смотреть онлайн;просмотр online
глаз тв смотреть онлайн;просмотр online
исчезнувшая анной снаткиной смотреть онлайн;просмотр online
смотреть онлайн фильмы года бесплатно хорошем качестве новинки золотая орда;просмотр online
смерть филателиста смотреть онлайн бесплатно хорошем качестве;просмотр online
реальные пацаны сезон смотреть онлайн;просмотр online
кино новинки вышедшие смотреть онлайн;просмотр online
забытая мелодия флейты смотреть онлайн;просмотр online
черепашки - ниндзя мультфильм смотреть онлайн серии подряд;просмотр online
укрощение строптивого смотреть онлайн хорошем качестве hd;просмотр online
детские песни самых маленьких клипы смотреть онлайн видео подряд;просмотр online
сериал золотая орда сезон смотреть онлайн;просмотр online
звездные войны смотреть онлайн;просмотр online
сериал осколки смотреть онлайн бесплатно;просмотр online
сериал табу сезон смотреть онлайн русском;просмотр online
лёд фильм смотреть онлайн;просмотр online
золотая орда смотреть онлайн фильм хорошем качестве;просмотр online
конец турецкий сериал русском языке смотреть онлайн;просмотр online
тульский токарев серия смотреть онлайн;просмотр online
геошторм смотреть онлайн хорошем качестве бесплатно hd;просмотр online
кровавая барыня сериал смотреть онлайн;просмотр online
каталог фаберлик беларуси смотреть онлайн;просмотр online
смотреть онлайн ведьма бэлр;просмотр online
купала спектакль раскиданае гняздо смотреть онлайн;просмотр online
тоня против смотреть онлайн;просмотр online
доброе утро смотреть онлайн;просмотр online
золотая орда сериал смотреть онлайн;просмотр online
смотреть онлайн саша таня;просмотр online
смотреть онлайн фильмы невидемая сторона;просмотр online
широко шагая смотреть онлайн бесплатно хорошем качестве hd;просмотр online
сериал золотая орда сезон смотреть онлайн;просмотр online
тв - смотреть онлайн прямой эфир;просмотр online
смотреть онлайн тнт канал прямом эфире;просмотр online
обиженные цветы турецкий сериал смотреть онлайн русском языке;просмотр online
исчезнувшая сериал смотреть онлайн;просмотр online
золотая орда смотреть онлайн фильм хорошем качестве;просмотр online
твц смотреть онлайн;просмотр online
кремень сезон смотреть онлайн;просмотр online
интерны смотреть онлайн;просмотр online
легенда смотреть онлайн фильм хорошем качестве;просмотр online
каталог орифлейм беларуси ценами бел руб смотреть онлайн;просмотр online
смотреть онлайн;просмотр online
дом свежие серии смотреть онлайн;просмотр online
мученицы смотреть онлайн;просмотр online
сериал осколки россия смотреть онлайн 1серия;просмотр online
фильм тайная любовница смотреть онлайн;просмотр online
смотреть онлайн г полдень ставропольского края;просмотр online
игорь лена смотреть онлайн серии подряд;просмотр online
кровавая барыня сериал смотреть онлайн;просмотр online
девочка спичками смотреть онлайн бесплатно хорошем качестве;просмотр online
украинские сериалы года новинки смотреть онлайн бесплатно;просмотр online
высокие ставки смотреть онлайн сезон;просмотр online
ходячие мертвецы смотреть онлайн;просмотр online
нарки сезон серия смотреть онлайн;просмотр online
тнт холостяк смотреть онлайн;просмотр online
остров сезон серия смотреть онлайн;просмотр online
