футбол смотреть онлайн;просмотр online
батель каталог январь смотреть онлайн;просмотр online
книга илая смотреть онлайн хорошем качестве;просмотр online
сериал колония сезон смотреть онлайн;просмотр online
полюса любви смотреть онлайн бесплатно;просмотр online
антураж смотреть онлайн бесплатно хорошем качестве;просмотр online
детективы великобритания смотреть онлайн бесплатно хорошем качестве;просмотр online
ювентус аталанта смотреть онлайн sopcast;просмотр online
мастер маргарита смотреть онлайн хорошем качестве;просмотр online
фильмы кончаловского смотреть онлайн;просмотр online
теория большого взрыва сезон серия кураж бомбей смотреть онлайн;просмотр online
фильм смерть сталина смотреть онлайн;просмотр online
алиса стране чудес смотреть онлайн;просмотр online
беларусь смотреть онлайн;просмотр online
большой лебовски смотреть онлайн;просмотр online
воскресший эртугрул сезон серия смотреть онлайн русском языке;просмотр online
смотреть онлайн матч ювентус аталанта;просмотр online
телесериал исчезнувшая смотреть онлайн;просмотр online
кино золотая орда смотреть онлайн;просмотр online
золотая орда сериал смотреть онлайн;просмотр online
смотреть онлайн фильмы бесплатно;просмотр online
футбол смотреть онлайн;просмотр online
новые елки смотреть онлайн;просмотр online
бавария бешикташ прямая трансляция смотреть онлайн;просмотр online
вечер владимиром соловьевым смотреть онлайн бесплатно;просмотр online
последние новости телеканалов россии смотреть онлайн;просмотр online
сериал кухня сезон смотреть онлайн;просмотр online
сериал кровавая барыня смотреть онлайн;просмотр online
интерны смотреть онлайн;просмотр online
легенда круге смотреть онлайн серии подряд хорошем качестве;просмотр online
сериал отбросы русская версия смотреть онлайн;просмотр online
пусть говорят выпуск г смотреть онлайн;просмотр online
золотая орда сериал смотреть онлайн;просмотр online
аниме смотреть онлайн;просмотр online
бодрумская сказка смотреть онлайн;просмотр online
смотреть онлайн великолепный век сезон серии хорошем качестве;просмотр online
время фильм смотреть онлайн hd трейлер;просмотр online
маленькое зло смотреть онлайн;просмотр online
бавария бешикташ прямая трансляция смотреть онлайн;просмотр online
движение вверх смотреть онлайн;просмотр online
порно смотреть онлайн;просмотр online
телеканал первый крымский смотреть онлайн прямой эфир;просмотр online
авангард салават юлаев смотреть онлайн;просмотр online
ментовские войны сезон смотреть онлайн хорошем качестве серии;просмотр online
турецкие сериалы русском языке смотреть онлайн;просмотр online
концерт кадышевой лет сцене смотреть онлайн;просмотр online
золотая орда смотреть онлайн фильм хорошем качестве;просмотр online
динозаврик советский мультик смотреть онлайн;просмотр online
ненависти любви смотреть онлайн;просмотр online
аритмия смотреть онлайн фильм хорошем качестве;просмотр online
фильмы приключения смотреть онлайн бесплатно хорошем качестве;просмотр online
фильм ветеран серии подряд смотреть онлайн;просмотр online
евроспорт смотреть онлайн прямой эфир;просмотр online
сериал двойник ту сторону смотреть онлайн;просмотр online
золотая орда сериал смотреть онлайн сезон серия;просмотр online
фильм ярость смотреть онлайн бесплатно хорошем качестве;просмотр online
новинки кино смотреть онлайн бесплатно хорошем качестве;просмотр online
невидимый гость смотреть онлайн;просмотр online
кинокрад легенда коловрате фильм смотреть онлайн полностью бесплатно;просмотр online
фильмы полицаев время вов смотреть онлайн;просмотр online
смотреть онлайн фильмы черная пантера;просмотр online
фильм пипец ъсмотреть онлайн бесплатно хорошем качестве hd;просмотр online
сериал древние сезон смотреть онлайн;просмотр online
девушка косой смотреть онлайн;просмотр online
бешикташ бавария марта смотреть онлайн;просмотр online
золотая орда сериал смотреть онлайн;просмотр online
футбол смотреть онлайн бишекташ бавария;просмотр online
нтв спб смотреть онлайн прямой эфир;просмотр online
ненависти любви смотреть онлайн серия;просмотр online
психологини смотреть онлайн;просмотр online
любовь прокат смотреть онлайн серии русскрм языке;просмотр online
фильм невижу неслышу смотреть онлайн;просмотр online
лермонтов сериал смотреть онлайн;просмотр online
золотая орда сериал серия смотреть онлайн;просмотр online
смотреть онлайн деревня;просмотр online
футбол смотреть онлайн;просмотр online
фильм последний богатырь смотреть онлайн;просмотр online
сейлормун кристалл смотреть онлайн;просмотр online
бешикташ бавария прямая трансляция смотреть онлайн;просмотр online
страсти чапаю смотреть онлайн серии подряд хорошем качестве;просмотр online
большие каникулы смотреть онлайн;просмотр online
элементарно смотреть онлайн;просмотр online
футбол смотреть онлайн;просмотр online
фаберлик каталог года смотреть онлайн россия бесплатно листать;просмотр online
новый клип ленинграда париж смотреть онлайн;просмотр online
квн высшая лига финала первая игра смотреть онлайн;просмотр online
тайны лауры сезон смотреть онлайн перевод fox life;просмотр online
золотая орда сериал смотреть онлайн;просмотр online
звёздные врата атлантида смотреть онлайн;просмотр online
ювентус аталанта смотреть онлайн трансляцию;просмотр online
бавария бешикташ смотреть онлайн;просмотр online
след смотреть онлайн;просмотр online
самом деле выпуск смотреть онлайн;просмотр online
спаси святой георгий сериал смотреть онлайн русском языке;просмотр online
детство шелдона смотреть онлайн серия;просмотр online
рэмпейдж фильм смотреть онлайн бесплатно хорошем качестве hd;просмотр online
окраина смотреть онлайн;просмотр online
зуми зуми мультфильм смотреть онлайн серии подряд бесплатно;просмотр online
ай карли сезоны серии смотреть онлайн бесплатно лагов;просмотр online
пассажиры смотреть онлайн фильм хорошем качестве русском;просмотр online
взвешенные счастливые люди стс смотреть онлайн;просмотр online
секс дружбе смотреть онлайн;просмотр online
золотая орда смотреть онлайн фильм хорошем качестве;просмотр online
великолепный век серия смотреть онлайн русском языке бесплатно хорошем качестве;просмотр online
генератор п фильм смотреть онлайн хорошем качестве;просмотр online
золотая орда сериал смотреть онлайн;просмотр online
кино альфа смотреть онлайн;просмотр online
российские детективы - смотреть онлайн;просмотр online
journee смотреть онлайн;просмотр online
написала убийство смотреть онлайн сезон серия;просмотр online
халк смотреть онлайн;просмотр online
беларусь смотреть онлайн;просмотр online
фильм половинки смотреть онлайн;просмотр online
кинорай - смотреть онлайн бесплатно;просмотр online
пазманский дьявол смотреть онлайн;просмотр online
смотреть онлайн чёрная пантера хорошем качестве hd;просмотр online
бавария бешикташ прямая трансляция смотреть онлайн;просмотр online
экипаж смотреть онлайн хорошем качестве;просмотр online
команда б смотреть онлайн серия;просмотр online
золотая орда смотреть онлайн;просмотр online
джессика джонс смотреть онлайн субтитры;просмотр online
ночные ведьмы летчицы фильм смотреть онлайн;просмотр online
фильм пекло смотреть онлайн;просмотр online
золотая орда смотреть онлайн;просмотр online
аркадий паровозов смотреть онлайн;просмотр online
склифосовский смотреть онлайн сезон хорошем качестве hd;просмотр online
сумерки часть смотреть онлайн бесплатно hd качестве;просмотр online
нло тв смотреть онлайн;просмотр online
андеграунд кустурицы смотреть онлайн бесплатно хорошем качестве;просмотр online
смотреть онлайн матч тв;просмотр online
одаренная смотреть онлайн;просмотр online
арло говорящий поросенок смотреть онлайн;просмотр online
районы смотреть онлайн;просмотр online
фильм пока спал смотреть онлайн бесплатно хорошем качестве;просмотр online
домашний смотреть онлайн прямой эфир;просмотр online
фильм ронинов смотреть онлайн бесплатно хорошем качестве;просмотр online
футбол смотреть онлайн прямой эфир;просмотр online
сериал сверхъестественное сезоны смотреть онлайн hd качестве;просмотр online
воскресший эртугрул сезон серия смотреть онлайн русском языке;просмотр online
смотреть онлайн бешикташ бавария;просмотр online
аннигиляция смотреть онлайн;просмотр online
назови турецкий сериал смотреть онлайн русском языке;просмотр online
волчонок смотреть онлайн;просмотр online
расскажи карадениз турецкий сериал смотреть онлайн русская озвучка;просмотр online
дом свежие серии смотреть онлайн бесплатно свежие серии;просмотр online
пространство сериал смотреть онлайн;просмотр online
смотреть фильм смотреть онлайн;просмотр online
бешикташ бавария смотреть онлайн;просмотр online
тихоокеанский рубеж смотреть онлайн;просмотр online
охота воров смотреть онлайн фильм хорошем качестве;просмотр online
казачья быль смотреть онлайн бесплатно хорошем качестве;просмотр online
фильм клетка смотреть онлайн хорошем качестве;просмотр online
ёлки новые смотреть онлайн;просмотр online
команда б серия смотреть онлайн бесплатно;просмотр online
моана смотреть онлайн;просмотр online
золотая орда сериал смотреть онлайн;просмотр online
слуга народу сезон смотреть онлайн;просмотр online
золотая орда сериал смотреть онлайн;просмотр online
куб фильм смотреть онлайн бесплатно качестве hd;просмотр online
скорая помощь сериал смотреть онлайн;просмотр online
фильм рога смотреть онлайн;просмотр online
кхл тв смотреть онлайн;просмотр online
школа смотреть онлайн серии подряд хорошем качестве;просмотр online
сериал осколки смотреть онлайн;просмотр online
команда б смотреть онлайн;просмотр online
час тв смотреть онлайн;просмотр online
салават юлаев авангард марта смотреть онлайн;просмотр online
дом турецкий фильм смотреть онлайн русском языке;просмотр online
снеговик смотреть онлайн фильм хорошем качестве русском;просмотр online
купи смотреть онлайн;просмотр online
seconds to mars клипы смотреть онлайн;просмотр online
великолепный век смотреть онлайн бесплатно;просмотр online
смотреть онлайн фильмы года бесплатно хорошем качестве новинки;просмотр online
монах бес смотреть онлайн;просмотр online
кровавая барыня сериал смотреть онлайн;просмотр online
копи царя соломона фильм смотреть онлайн;просмотр online
добиться успеха америке смотреть онлайн;просмотр online
вверх смотреть онлайн;просмотр online
дорога жёлтого кирпича смотреть онлайн бесплатно хорошем качестве;просмотр online
фильм каникулы смотреть онлайн;просмотр online
фильм золотая орда сериал смотреть онлайн россия бесплатно;просмотр online
халк фильм смотреть онлайн;просмотр online
вилы смотреть онлайн;просмотр online
хб сезон смотреть онлайн бесплатно;просмотр online
двенадцать друзей оушена фильм смотреть онлайн;просмотр online
паддингтон смотреть онлайн;просмотр online
поисках улик сериал смотреть онлайн серии подряд;просмотр online
фар край смотреть онлайн;просмотр online
маленькая большая ложь смотреть онлайн;просмотр online
шумный день фильм смотреть онлайн;просмотр online
борджиа сезон серия смотреть онлайн бесплатно хорошем качестве;просмотр online
убийцы фазана смотреть онлайн;просмотр online
фильм ванхельсинг смотреть онлайн хорошем качестве;просмотр online
фильмы фантастика - список лучших фильмов смотреть онлайн;просмотр online
дартаньяна мушкетера смотреть онлайн;просмотр online
астрал смотреть онлайн;просмотр online
фільм история первой любви смотреть онлайн;просмотр online
дом кино смотреть онлайн прямой эфир бесплатно хорошем качестве;просмотр online
спанч боб смотреть онлайн серии подряд;просмотр online
орда сериал смотреть онлайн;просмотр online
мультик свинку пепу подряд смотреть онлайн остановки;просмотр online
самом деле марта года смотреть онлайн бесплатно;просмотр online
свинка пеппа смотреть онлайн бесплатно серии русском;просмотр online
абсолютное зло смотреть онлайн;просмотр online
смотреть онлайн ролики бесплатно регистрации смс порно юные невесты;просмотр online
ненависти любви смотреть онлайн;просмотр online
тоня смотреть онлайн;просмотр online
ювентус аталанта марта смотреть онлайн;просмотр online
заводной парень смотреть онлайн хорошем качестве;просмотр online
тайна коко смотреть онлайн бесплатно;просмотр online
петербургские тайны - чссерия смотреть онлайн;просмотр online
призрачная нить смотреть онлайн;просмотр online
викинг смотреть онлайн;просмотр online
несмотря смотреть онлайн;просмотр online
предложение смотреть онлайн;просмотр online
джуманджи смотреть онлайн;просмотр online
бешикташ бавария смотреть онлайн;просмотр online
сериал золотая орда сезон смотреть онлайн;просмотр online
любовь взрослых смотреть онлайн;просмотр online
смотреть онлайн бесплатно фильм темная ночь незнакомцы;просмотр online
смотреть онлайн пророк;просмотр online
лед смотреть онлайн;просмотр online
тайна зимнего леса мультик смотреть онлайн;просмотр online
человек - муравей смотреть онлайн;просмотр online
уцелевший фильм hd смотреть онлайн;просмотр online
сериал осколки россия смотреть онлайн;просмотр online
огниво мультик смотреть онлайн бесплатно хорошем;просмотр online
великолепный век смотреть онлайн;просмотр online
фантастические твари обитают фильм смотреть онлайн;просмотр online
фильм лучший фильм смотреть онлайн бесплатно хорошем качестве;просмотр online
кино смотреть онлайн;просмотр online
битва экстрасенсов сезон смотреть онлайн бесплатно hd;просмотр online
сериал синдром шахматиста сезон смотреть онлайн;просмотр online
смотреть онлайн русский роман;просмотр online
золотая орда смотреть онлайн фильм хорошем качестве;просмотр online
движение вверх смотреть онлайн;просмотр online
фильмы смотреть онлайн;просмотр online
фильмы года смотреть онлайн бесплатно хорошем качестве;просмотр online
вор фильм владимира курского смотреть онлайн;просмотр online
фильмы диких зверей убийц смотреть онлайн;просмотр online
лед смотреть онлайн фильм хорошем качестве;просмотр online
золотая орда сериал смотреть онлайн бесплатно;просмотр online
воронины сезон серия смотреть онлайн;просмотр online
хроники московского быта смотреть онлайн серии;просмотр online
новый человек - паук высокое напряжение смотреть онлайн бесплатно хорошем;просмотр online
зона x последний выпуск смотреть онлайн;просмотр online
молодёжка сезон смотреть онлайн бесплатно хорошем качестве;просмотр online
план побега смотреть онлайн;просмотр online
кино смотреть онлайн бесплатно хорошем качестве;просмотр online
сериал жив процентов смотреть онлайн;просмотр online
золотая орда сериал смотреть онлайн серия;просмотр online
властелин колец переводом орков эльфов смотреть онлайн;просмотр online
золотая орда сериал смотреть онлайн;просмотр online
викинг смотреть онлайн фильм хорошем качестве;просмотр online
оттенков свободы смотреть онлайн фильм полностью;просмотр online
невский сезон развязка сериал серии смотреть онлайн;просмотр online
иностранец смотреть онлайн;просмотр online
менталист сезон смотреть онлайн;просмотр online
диктатор смотреть онлайн;просмотр online
бешикташ бавария марта смотреть онлайн;просмотр online
