футбол смотреть онлайн;просмотр online
егор шилов смотреть онлайн;просмотр online
смотреть онлайн матч футбол прямая трансляция;просмотр online
команда б смотреть онлайн серии хорошем качестве бесплатно;просмотр online
ветряная река смотреть онлайн;просмотр online
мужское - женское смотреть онлайн;просмотр online
сериал последний москаль сезон смотреть онлайн серии;просмотр online
фермер ищет жену сезон смотреть онлайн;просмотр online
ударов сердца минуту смотреть онлайн;просмотр online
новые русские фильмы года смотреть онлайн бесплатно россия;просмотр online
смотреть онлайн русские криминальные сериалы;просмотр online
шахтер рома смотреть онлайн;просмотр online
время первых смотреть онлайн;просмотр online
совместная поездка смотреть онлайн;просмотр online
сериал справедливость бразилия смотреть онлайн русском;просмотр online
китайский новый год фильм смотреть онлайн бесплатно хорошем качестве;просмотр online
золотая орда сериал смотреть онлайн;просмотр online
тьма сериал смотреть онлайн;просмотр online
чёрная лагуна смотреть онлайн бесплатно хорошем качестве;просмотр online
сериал осколки серия канал россия смотреть онлайн бесплатно;просмотр online
смотреть онлайн филмы;просмотр online
кости смотреть онлайн;просмотр online
кино золотая орда смотреть онлайн бесплатно хорошем качестве;просмотр online
рома шахтер смотреть онлайн бессплатно;просмотр online
против шторму смотреть онлайн;просмотр online
футбол смотреть онлайн;просмотр online
реальные пацаны смотреть онлайн;просмотр online
муж напрокат смотреть онлайн домашнем;просмотр online
смотреть онлайн сумерки новолуние хорошем качестве hd;просмотр online
тв зарубежное кино смотреть онлайн прямой эфир мэйл;просмотр online
сериал звоните солу смотреть онлайн бесплатно хорошем качестве;просмотр online
интерны смотреть онлайн;просмотр online
новинки мультики смотреть онлайн;просмотр online
недруги смотреть онлайн фильм хорошем качестве;просмотр online
золотая орда5 серия смотреть онлайн;просмотр online
сериал спасатели малибу сезон смотреть онлайн русском языке;просмотр online
кондитерская антик дорама смотреть онлайн;просмотр online
золотая орда сериал смотреть онлайн бесплатно хорошем качестве;просмотр online
великолепный век смотреть онлайн;просмотр online
скам смотреть онлайн;просмотр online
смотреть онлайн фильмы;просмотр online
стрелок сезон россия смотреть онлайн;просмотр online
геометрия любви смотреть онлайн;просмотр online
дикий смотреть онлайн фильм хорошем качестве;просмотр online
прикуп смотреть онлайн хорошим переводом хорошем качестве;просмотр online
фильмы года смотреть онлайн бесплатно хорошем качестве;просмотр online
герои сериал смотреть онлайн hd;просмотр online
рома шахтер смотреть онлайн;просмотр online
коломбо смотреть онлайн серии подряд хорошем качестве;просмотр online
хороший парень смотреть онлайн;просмотр online
грозовые ворота смотреть онлайн;просмотр online
канал россия смотреть онлайн прямой эфир хорошем качестве;просмотр online
футбол смотреть онлайн;просмотр online
король квинса смотреть онлайн;просмотр online
сериал вольная грамота смотреть онлайн;просмотр online
смотреть онлайн беларусь;просмотр online
сверхъестественное смотреть онлайн;просмотр online
смотреть онлайн первый мститет;просмотр online
фильм секретное досье смотреть онлайн;просмотр online
великолепный век смотреть онлайн русском сезон серия;просмотр online
муж напрокат смотреть онлайн те вышли;просмотр online
телеканалы россии смотреть онлайн прямой эфир бесплатно;просмотр online
матч футбол смотреть онлайн;просмотр online
губная помада твоем воротничке смотреть онлайн сериал;просмотр online
команда б смотреть онлайн;просмотр online
дорама королева мая смотреть онлайн русской озвучкой;просмотр online
смотреть онлайн;просмотр online
киборги фильм украина смотреть онлайн;просмотр online
тор рагнарёк фильм смотреть онлайн хорошем hd качестве;просмотр online
ужасы смотреть онлайн hd;просмотр online
канал футбол смотреть онлайн;просмотр online
менталист смотреть онлайн;просмотр online
викинги смотреть онлайн hd lostfilm;просмотр online
исчезнувшая сериал смотреть онлайн;просмотр online
иван бровкин целине фильм смотреть онлайн высоком качестве;просмотр online
полтергейст обратная сторона смотреть онлайн;просмотр online
смотреть онлайн фильмы;просмотр online
ловушка лжи аниме смотреть онлайн;просмотр online
фильм гоголь начало год смотреть онлайн;просмотр online
футурама полнометражки смотреть онлайн;просмотр online
смотреть онлайн сериал роузвуд;просмотр online
худ фильмы вов - новинки смотреть онлайн русские сериалы;просмотр online
фильмы смотреть онлайн хорошем качестве бесплатно;просмотр online
крепись смотреть онлайн;просмотр online
безумная свадьба смотреть онлайн;просмотр online
алиенист смотреть онлайн;просмотр online
викинги сезон смотреть онлайн;просмотр online
аннигиляция фильм смотреть онлайн бесплатно;просмотр online
фильм пелагея белый бульдог серия смотреть онлайн бесплатно;просмотр online
зачетный период смотреть онлайн;просмотр online
тренер фильм смотреть онлайн;просмотр online
канал беларусь смотреть онлайн прямой эфир;просмотр online
бесстыжие смотреть онлайн;просмотр online
смотреть онлайн кровавая барыня хорошем качестве;просмотр online
золотая орда смотреть онлайн фильм хорошем качестве;просмотр online
холостяк смотреть онлайн;просмотр online
аббатство даунтон сезон серия смотреть онлайн хорошем качестве;просмотр online
смотреть онлайн мультфильм злодея;просмотр online
сериал двойник смотреть онлайн;просмотр online
футбол смотреть онлайн;просмотр online
сериал золотая орда сезон смотреть онлайн;просмотр online
макар - следопыт фильм смотреть онлайн;просмотр online
геошторм смотреть онлайн;просмотр online
аниме смотреть онлайн играй эуфониум;просмотр online
реальная белка мультфильм смотреть онлайн бесплатно;просмотр online
манчестер юнайтед севилья марта смотреть онлайн прямой эфир прямая видео трансляция;просмотр online
смотреть онлайн канал футбол;просмотр online
гномов смотреть онлайн;просмотр online
секс мама дочкой анальный крупный план смотреть онлайн бесплатно;просмотр online
худею фильм смотреть онлайн;просмотр online
искушение hd смотреть онлайн канал;просмотр online
сериал сын ворона смотреть онлайн;просмотр online
с ветерком малибу смотреть онлайн;просмотр online
большая игра смотреть онлайн фильм хорошем качестве;просмотр online
американское преступление фильм смотреть онлайн;просмотр online
властелин колец полная режиссерская версия смотреть онлайн;просмотр online
смотреть онлайн али нино;просмотр online
футбол шахтёр рома сегодня смотреть онлайн;просмотр online
фильм гонка века смотреть онлайн;просмотр online
форсаж 1080p смотреть онлайн;просмотр online
девятая сессия смотреть онлайн хорошим переводом;просмотр online
дело чести турецкий сериал смотреть онлайн русском языке;просмотр online
драмы другие гей фильмы откровенными сценами смотреть онлайн;просмотр online
фильм ученик кирилл серебренников смотреть онлайн;просмотр online
экстрасенсы битва сильнейших год смотреть онлайн новый выпуск;просмотр online
ту сторону смерти сериал смотреть онлайн;просмотр online
фильм скалолаз сильвестр сталлоне смотреть онлайн;просмотр online
цель номер фильм смотреть онлайн;просмотр online
манчестер юнайтед севилья марта смотреть онлайн;просмотр online
рик морти сезон серия сыендук смотреть онлайн хорошем качестве;просмотр online
пьяный мастер смотреть онлайн;просмотр online
центре внимания смотреть онлайн;просмотр online
идеальный ремонт киркорова смотреть онлайн;просмотр online
бриллиантовые псы фильм смотреть онлайн;просмотр online
золотая орда сериал смотреть онлайн;просмотр online
шоу холостяк украина сезон смотреть онлайн выпуски;просмотр online
дьявол носит прада смотреть онлайн;просмотр online
талисман любви смотреть онлайн;просмотр online
бесите смотреть онлайн;просмотр online
улисес плюс айноя сезон серии смотреть онлайн;просмотр online
гладиатрикс фильм смотреть онлайн;просмотр online
лёд фильм смотреть онлайн;просмотр online
смолевичском районепить дом смотреть онлайн;просмотр online
тюльпановая лихорадка фильм смотреть онлайн;просмотр online
порно русского смотреть онлайн отличном качестве;просмотр online
stranger things сезон смотреть онлайн субтитры;просмотр online
тоня против смотреть онлайн хорошем качестве;просмотр online
ходячие мертвецы смотреть онлайн hd;просмотр online
смотреть онлайн спортивные каналы бесплатно;просмотр online
великолепный век серия смотреть онлайн русском языке бесплатно;просмотр online
золотая орда сериал смотреть онлайн;просмотр online
афера доктора нока фильм смотреть онлайн;просмотр online
крёстная мать фильм смотреть онлайн;просмотр online
обычные медведи смотреть онлайн серии подряд;просмотр online
клиника смотреть онлайн;просмотр online
холостяк дата егор крид смотреть онлайн бесплатно хорошем качестве;просмотр online
фильм лавстори смотреть онлайн полный фильм;просмотр online
сериал искупление россия смотреть онлайн ютубе;просмотр online
запретная любовь серия смотреть онлайн;просмотр online
уральские пельмени смотреть онлайн новое;просмотр online
футбол смотреть онлайн;просмотр online
коматозники смотреть онлайн фильм хорошем качестве;просмотр online
викинги смотреть онлайн;просмотр online
золотая орда смотреть онлайн фильм хорошем качестве;просмотр online
ю прямая трансляция смотреть онлайн;просмотр online
бегущий лабиринте смотреть онлайн;просмотр online
охранник дочери смотреть онлайн;просмотр online
дочь мать её фильм смотреть онлайн;просмотр online
русские сериалы смотреть онлайн;просмотр online
железный человек смотреть онлайн hd;просмотр online
ненависти любви смотреть онлайн;просмотр online
матрица времени смотреть онлайн;просмотр online
вечер владимиром соловьевым смотреть онлайн бесплатно;просмотр online
смотреть онлайн видео кунилингус;просмотр online
рома шахтер смотреть онлайн прямую трансляцию;просмотр online
беларусь смотреть онлайн;просмотр online
кролик питер смотреть онлайн hd;просмотр online
x men apocalypse смотреть онлайн;просмотр online
алиса стране чудес фильм смотреть онлайн hd;просмотр online
мультфильм стать легендой смотреть онлайн бесплатно;просмотр online
э р ческие фильмы года смотреть онлайн бесплатно;просмотр online
оттенков темнее смотреть онлайн;просмотр online
порно огромные сиськи смотреть онлайн бесплатно;просмотр online
солт смотреть онлайн;просмотр online
lion смотреть онлайн;просмотр online
футбол смотреть онлайн прямой эфир хорошем качестве;просмотр online
смотреть онлайн;просмотр online
высокие ставки реванш смотреть онлайн бесплатно;просмотр online
золотая орда смотреть онлайн фильм хорошем качестве;просмотр online
футбол украина смотреть онлайн;просмотр online
смотреть онлайн порно манашки;просмотр online
мифы смотреть онлайн фильм хорошем качестве;просмотр online
начало турецкий сериал смотреть онлайн русском языке бесплатно;просмотр online
песни тнт выпуск смотреть онлайн;просмотр online
игра престолов смотреть онлайн;просмотр online
цветок тюрьме дорама смотреть онлайн бесплатно;просмотр online
гейм шоу смотреть онлайн;просмотр online
место встречи фильм смотреть онлайн;просмотр online
эйс вентура зов природы смотреть онлайн бесплатно хорошем качестве;просмотр online
водила смотреть онлайн;просмотр online
дом смотреть онлайн;просмотр online
фильм убийство дания смотреть онлайн;просмотр online
проститутки смотреть онлайн бесплатно;просмотр online
официальный сайт дом тнт смотреть онлайн бесплатно;просмотр online
youtube фильмы смотреть онлайн бесплatno spartak krow i pesok;просмотр online
сваты сезоны смотреть онлайн;просмотр online
вне смотреть онлайн хорошем качестве;просмотр online
сериал инспектор деррик дублированный смотреть онлайн;просмотр online
порно смотреть онлайн;просмотр online
красная шапочка фильм смотреть онлайн;просмотр online
дом2 ночной эфир смотреть онлайн;просмотр online
воин смотреть онлайн;просмотр online
лед смотреть онлайн;просмотр online
казино рояль фильм смотреть онлайн;просмотр online
влюбленные женщины сериал смотреть онлайн;просмотр online
смотреть онлайн вечер владимиром соловьевым последний выпуск;просмотр online
золотая орда смотреть онлайн фильм хорошем качестве;просмотр online
навсикая долины ветров смотреть онлайн переводом;просмотр online
последний богатырь смотреть онлайн;просмотр online
видео секса дикторшами тв каналов - смотреть онлайн хорошем качестве бесплатно авторизации регистрации скачивания паролей смс;просмотр online
рома шахтер смотреть онлайн;просмотр online
тайны чапман смотреть онлайн;просмотр online
грехов смотреть онлайн;просмотр online
вечер владимиром соловьевым выпуск смотреть онлайн;просмотр online
маргоша сезон смотреть онлайн серии подряд хорошем качестве;просмотр online
осколки россия смотреть онлайн субтитрами;просмотр online
тнт холостяк смотреть онлайн;просмотр online
холостяк егор крид серия смотреть онлайн;просмотр online
путешествие времени доктора джина дорама смотреть онлайн;просмотр online
студия союз смотреть онлайн тимати;просмотр online
флэш смотреть онлайн;просмотр online
зона сериал смотреть онлайн серии;просмотр online
тинилав мульт полная версия смотреть онлайн;просмотр online
багровый пик смотреть онлайн;просмотр online
отчаянные домохозяйки смотреть онлайн hd;просмотр online
холостяк россия смотреть онлайн;просмотр online
пекло смотреть онлайн;просмотр online
смотреть онлайн фильм решала;просмотр online
терминатор смотреть онлайн;просмотр online
исчезнувшие войну смотреть онлайн бесплатно качестве hd;просмотр online
невеста москвы серия смотреть онлайн;просмотр online
киллеры смотреть онлайн;просмотр online
сотня смотреть онлайн;просмотр online
секс малолеток смотреть онлайн;просмотр online
осколки смотреть онлайн;просмотр online
парень псих английском субтитрами смотреть онлайн;просмотр online
вики кристина барселона смотреть онлайн;просмотр online
криминальное чтиво смотреть онлайн;просмотр online
самый лучший фильм рота нагиевым смотреть онлайн;просмотр online
смотреть фильм спартак кровь песок сезон смотреть онлайн;просмотр online
иностранец смотреть онлайн фильм хорошем качестве;просмотр online
команда б серия смотреть онлайн;просмотр online
русские фильмы смотреть онлайн бесплатно хорошем качестве;просмотр online
оттенков серого смотреть онлайн;просмотр online
смертельное оружие сезон серия смотреть онлайн;просмотр online
великолепный век сезон серия смотреть онлайн русском языке;просмотр online
старые зарубежные боевики - х - х годов смотреть онлайн;просмотр online
лёд фильм смотреть онлайн;просмотр online
сериал осколки россия смотреть онлайн серии;просмотр online
декстер смотреть онлайн;просмотр online
дамаской стали смотреть онлайн;просмотр online
форма воды смотреть онлайн;просмотр online
фильмы смотреть онлайн;просмотр online
тайны прошлого смотреть онлайн;просмотр online
братья оружию сериал смотреть онлайн;просмотр online
кинокрад новинки кино смотреть онлайн;просмотр online
